Продукт,Калорийность,Белки,Жиры,Углеводы
"BURGER KING, ванильный коктейль",168 кКал,168 кКал,168 кКал,168 кКал
"BURGER KING, гамбургер",261 кКал,261 кКал,261 кКал,261 кКал
"BURGER KING, двойной ""WHOPPER"", без сыра",252 кКал,252 кКал,252 кКал,252 кКал
"BURGER KING, двойной ""WHOPPER"", с сыром",266 кКал,266 кКал,266 кКал,266 кКал
"BURGER KING, драники",302 кКал,302 кКал,302 кКал,302 кКал
"BURGER KING, картошка фри",280 кКал,280 кКал,280 кКал,280 кКал
"BURGER KING, круассан ""CROISSAN'WICH"" с сосиской и сыром",376 кКал,376 кКал,376 кКал,376 кКал
"BURGER KING, круассан ""CROISSAN'WICH"" с сосиской, яйцом и сыром",308 кКал,308 кКал,308 кКал,308 кКал
"BURGER KING, круассан ""CROISSAN'WICH"" с яйцом и сыром",283 кКал,283 кКал,283 кКал,283 кКал
"BURGER KING, куриное филе ""CHICKEN TENDERS""",292 кКал,292 кКал,292 кКал,292 кКал
"BURGER KING, куриный сэндвич ""Original Chicken Sandwich""",286 кКал,286 кКал,286 кКал,286 кКал
"BURGER KING, сэндвич ""WHOPPER"", без сыра",233 кКал,233 кКал,233 кКал,233 кКал
"BURGER KING, сэндвич ""WHOPPER"", с сыром",250 кКал,250 кКал,250 кКал,250 кКал
"BURGER KING, французские гренки",349 кКал,349 кКал,349 кКал,349 кКал
"BURGER KING, чизбургер",286 кКал,286 кКал,286 кКал,286 кКал
"DOMINO'S, пицца ""EXTRAVAGANZZA FEAST"", на классическом корже, сформированном вручную, 14 дюймов",244 кКал,244 кКал,244 кКал,244 кКал
"DOMINO'S, пицца с паперони ""Pepperoni Pizza"", на замороженном корже, 14 дюймов",283 кКал,283 кКал,283 кКал,283 кКал
"DOMINO'S, пицца с паперони ""Pepperoni Pizza"", на классическом корже, сформированном вручную, 14 дюймов",273 кКал,273 кКал,273 кКал,273 кКал
"DOMINO'S, сырная пицца ""Cheese Pizza"", на замороженном корже, 14 дюймов",265 кКал,265 кКал,265 кКал,265 кКал
"DOMINO'S, сырная пицца ""Cheese Pizza"", на классическом корже, сформированном вручную, 14 дюймов",257 кКал,257 кКал,257 кКал,257 кКал
"DOMINO'S, сырная пицца ""Cheese Pizza"", на тонком корже с кусочками арахиса",298 кКал,298 кКал,298 кКал,298 кКал
"KENTUCKY FRIED CHICKEN, бисквит, информация состоянием на январь 2007",358 кКал,358 кКал,358 кКал,358 кКал
"KENTUCKY FRIED CHICKEN, жареная в панировке курица ""EXTRA CRISPY"", бедра, мясо и шкурка, информация состоянием на январь 2007",309 кКал,309 кКал,309 кКал,309 кКал
"KENTUCKY FRIED CHICKEN, жареная в панировке курица ""EXTRA CRISPY"", крылышки, мясо и шкурка, информация состоянием на  январе 2007",337 кКал,337 кКал,337 кКал,337 кКал
"KENTUCKY FRIED CHICKEN, жареная в панировке курица ""EXTRA CRISPY"", ножки, мясо и шкурка, информация состоянием на январь 2007",274 кКал,274 кКал,274 кКал,274 кКал
"KENTUCKY FRIED CHICKEN, жареная в панировке курица ""EXTRA CRISPY"", шкурка, информация состоянием на январь 2007",464 кКал,464 кКал,464 кКал,464 кКал
"KENTUCKY FRIED CHICKEN, жареная в панировке курица ""ORIGINAL RECIPE"", бедра, мясо и шкурка, информация состоянием на январь 2007",269 кКал,269 кКал,269 кКал,269 кКал
"KENTUCKY FRIED CHICKEN, жареная в панировке курица ""ORIGINAL RECIPE"", грудка, мясо и шкурка, информация состоянием на январь 2007",231 кКал,231 кКал,231 кКал,231 кКал
"KENTUCKY FRIED CHICKEN, жареная в панировке курица ""ORIGINAL RECIPE"", крылышки, мясо и шкурка, информация состоянием на  январь 2007",297 кКал,297 кКал,297 кКал,297 кКал
"KENTUCKY FRIED CHICKEN, жареная в панировке курица ""ORIGINAL RECIPE"", ножки, мясо и шкурка, информация состоянием на  январь 2007",239 кКал,239 кКал,239 кКал,239 кКал
"KENTUCKY FRIED CHICKEN, жареная в панировке курица ""ORIGINAL RECIPE"", шкурка, информация состоянием на  январь 2007",384 кКал,384 кКал,384 кКал,384 кКал
"KENTUCKY FRIED CHICKEN, жареная курица ""EXTRA CRISPY"", бедра, только мясо,  информация состоянием на  январь 2007",179 кКал,179 кКал,179 кКал,179 кКал
"KENTUCKY FRIED CHICKEN, жареная курица ""EXTRA CRISPY"", грудка, только мясо, информация состоянием на январь 2007",153 кКал,153 кКал,153 кКал,153 кКал
"KENTUCKY FRIED CHICKEN, жареная курица ""EXTRA CRISPY"", крылышки, только мясо, информация состоянием на  январь 2007",236 кКал,236 кКал,236 кКал,236 кКал
"KENTUCKY FRIED CHICKEN, жареная курица ""EXTRA CRISPY"", ножки, только мясо, информация состоянием на  январь 2007",170 кКал,170 кКал,170 кКал,170 кКал
"KENTUCKY FRIED CHICKEN, жареная курица ""ORIGINAL RECIPE"" ножки, только мясо, информация состоянием на  январь 2007",175 кКал,175 кКал,175 кКал,175 кКал
"KENTUCKY FRIED CHICKEN, жареная курица ""ORIGINAL RECIPE"", бедра, только мясо, информация состоянием на  январь 2007",175 кКал,175 кКал,175 кКал,175 кКал
"KENTUCKY FRIED CHICKEN, жареная курица ""ORIGINAL RECIPE"", грудка, только мясо, информация состоянием на  январь 2007",149 кКал,149 кКал,149 кКал,149 кКал
"KENTUCKY FRIED CHICKEN, жареная курица ""ORIGINAL RECIPE"", крылышки, только мясо, информация состоянием на  январь 2007",216 кКал,216 кКал,216 кКал,216 кКал
"KENTUCKY FRIED CHICKEN, жаренаяв панировке курица ""EXTRA CRISPY"", грудка, мясо и шкурка, информация состоянием на янваье 2007",268 кКал,268 кКал,268 кКал,268 кКал
"KENTUCKY FRIED CHICKEN, куринный попкорн, информация состоянием на январь 2007",351 кКал,351 кКал,351 кКал,351 кКал
"KENTUCKY FRIED CHICKEN, салат из капусты",144 кКал,144 кКал,144 кКал,144 кКал
"KENTUCKY FRIED CHICKEN, хрустящие куринные полосочки, информация состоянием на  январь 2007",274 кКал,274 кКал,274 кКал,274 кКал
"LITTLE CAESARS, пицца с мясом и овощами, на оригинальном корже, 14 дюймов",243 кКал,243 кКал,243 кКал,243 кКал
"LITTLE CAESARS, пицца с паперони ""Original Round Pepperoni Pizza"", на стандартном корже, 14 дюймов",273 кКал,273 кКал,273 кКал,273 кКал
"LITTLE CAESARS, пицца с паперони ""Pepperoni Pizza"", на большом замороженном корже, 14 дюймов",265 кКал,265 кКал,265 кКал,265 кКал
"LITTLE CAESARS, сырная пицца ""Cheese Pizza"", на большом замороженном корже, 14 дюймов",263 кКал,263 кКал,263 кКал,263 кКал
"LITTLE CAESARS, сырная пицца ""Cheese Pizza"", на тонком корже, 14 дюймов",309 кКал,309 кКал,309 кКал,309 кКал
"LITTLE CAESARS, сырная пицца ""Original Round Cheese Pizza"", на стандартном корже, 14 дюймов",265 кКал,265 кКал,265 кКал,265 кКал
"McDONALD'S, ""BIG MAC""",257 кКал,257 кКал,257 кКал,257 кКал
"McDONALD'S, ""BIG MAC"" (без соуса Big Mac)",234 кКал,234 кКал,234 кКал,234 кКал
"McDONALD'S, ""Chicken McNUGGETS""",302 кКал,302 кКал,302 кКал,302 кКал
"McDONALD'S, бисквит с беконом, яйцом и сыром",304 кКал,304 кКал,304 кКал,304 кКал
"McDONALD'S, бисквит с котлетой",376 кКал,376 кКал,376 кКал,376 кКал
"McDONALD'S, бисквит с котлетой и яйцом",311 кКал,311 кКал,311 кКал,311 кКал
"McDONALD'S, буррито с котлетой",262 кКал,262 кКал,262 кКал,262 кКал
"McDONALD'S, гамбургер",264 кКал,264 кКал,264 кКал,264 кКал
"McDONALD'S, готовые завтраки ""BIG BREAKFAST""",285 кКал,285 кКал,285 кКал,285 кКал
"McDONALD'S, двойной сэндвич ""QUARTER POUNDER"" с сыром",262 кКал,262 кКал,262 кКал,262 кКал
"McDONALD'S, двойной чизбургер",282 кКал,282 кКал,282 кКал,282 кКал
"McDONALD'S, драники",262 кКал,262 кКал,262 кКал,262 кКал
"McDONALD'S, завтрак ""Deluxe"", с сиропом и маргарином",285 кКал,285 кКал,285 кКал,285 кКал
"McDONALD'S, йогуртово-фруктовое Парфе",105 кКал,105 кКал,105 кКал,105 кКал
"McDONALD'S, йогуртово-фруктовое Парфе (без гранолы)",90 кКал,90 кКал,90 кКал,90 кКал
"McDONALD'S, картошка фри",323 кКал,323 кКал,323 кКал,323 кКал
"McDONALD'S, котлета McGRIDDLES",312 кКал,312 кКал,312 кКал,312 кКал
"McDONALD'S, котлета McMuffin",333 кКал,333 кКал,333 кКал,333 кКал
"McDONALD'S, котлета McMuffin с яйцом",274 кКал,274 кКал,274 кКал,274 кКал
"McDONALD'S, котлета McMuffin с яйцом и сыром",283 кКал,283 кКал,283 кКал,283 кКал
"McDONALD'S, мороженное ""McFLURRY"" с конфетами ""M and M'S""",177 кКал,177 кКал,177 кКал,177 кКал
"McDONALD'S, мороженное ""McFLURRY"" с печеньем ""OREO""",165 кКал,165 кКал,165 кКал,165 кКал
"McDONALD'S, обезжиренное ванильное мороженое, рожок",162 кКал,162 кКал,162 кКал,162 кКал
"McDONALD'S, оладьи",228 кКал,228 кКал,228 кКал,228 кКал
"McDONALD'S, оладьи (с двумя шариками масла и сиропом)",272 кКал,272 кКал,272 кКал,272 кКал
"McDONALD'S, оладьи с сосисками",294 кКал,294 кКал,294 кКал,294 кКал
"McDONALD'S, пломбир клубничный",158 кКал,158 кКал,158 кКал,158 кКал
"McDONALD'S, пломбир с горячей карамелью",188 кКал,188 кКал,188 кКал,188 кКал
"McDONALD'S, пломбир с горячей помадкой",186 кКал,186 кКал,186 кКал,186 кКал
"McDONALD'S, рыбный сэндвич ""FILET-O-FISH""",282 кКал,282 кКал,282 кКал,282 кКал
"McDONALD'S, рыбный сэндвич ""FILET-O-FISH"" (без соуса тартар)",243 кКал,243 кКал,243 кКал,243 кКал
"McDONALD'S, салат с беконом и хрустящей курятиной ""Bacon Ranch Salad""",122 кКал,122 кКал,122 кКал,122 кКал
"McDONALD'S, сэндвич ""McCHICKEN"" (без майонеза)",240 кКал,240 кКал,240 кКал,240 кКал
"McDONALD'S, сэндвич ""McMUFFIN"" с яйцом",228 кКал,228 кКал,228 кКал,228 кКал
"McDONALD'S, сэндвич ""QUARTER POUNDER""",244 кКал,244 кКал,244 кКал,244 кКал
"McDONALD'S, сэндвич ""QUARTER POUNDER"" (с сыром)",258 кКал,258 кКал,258 кКал,258 кКал
"McDONALD'S, сэндвич с беконом, яйцом и сыром ""McGRIDDLES""",272 кКал,272 кКал,272 кКал,272 кКал
"McDONALD'S, чизбургер",263 кКал,263 кКал,263 кКал,263 кКал
"PAPA JOHN'S, пицца ""Works Pizza"", на фирменном корже, 14 дюймов",240 кКал,240 кКал,240 кКал,240 кКал
"PAPA JOHN'S, пицца с паперони ""Pepperoni Pizza"", на оригинальном корже, 14 дюймов",275 кКал,275 кКал,275 кКал,275 кКал
"PAPA JOHN'S, сырная пицца ""Cheese Pizza"", на оригинальмом корже, 14 дюймов",260 кКал,260 кКал,260 кКал,260 кКал
"PAPA JOHN'S, сырная пицца ""Cheese Pizza"", на тонком корже, 14 дюймов",295 кКал,295 кКал,295 кКал,295 кКал
"PIZZA HUT, пицца ""Super Supreme Pizza"", на стандартном корже, 12 дюймов",243 кКал,243 кКал,243 кКал,243 кКал
"PIZZA HUT, пицца ""Super Supreme Pizza"", на стандартном корже, 14 дюймов",248 кКал,248 кКал,248 кКал,248 кКал
"PIZZA HUT, пицца с паперони ""Pepperoni Pizza"", на стандартном корже, 12 дюймов",280 кКал,280 кКал,280 кКал,280 кКал
"PIZZA HUT, пицца с паперони ""Pepperoni Pizza"", на стандартном корже, 14 дюймов",291 кКал,291 кКал,291 кКал,291 кКал
"PIZZA HUT, пицца с паперони ""Pepperoni Pizza"", на толстом корже, 12 дюймов",298 кКал,298 кКал,298 кКал,298 кКал
"PIZZA HUT, пицца с паперони ""Pepperoni Pizza"", на толстом корже, 14 дюймов",291 кКал,291 кКал,291 кКал,291 кКал
"PIZZA HUT, сырная пицца ""Cheese Pizza"", на стандартном корже, 12 дюймов",271 кКал,271 кКал,271 кКал,271 кКал
"PIZZA HUT, сырная пицца ""Cheese Pizza"", на стандартном корже, 14 дюймов",275 кКал,275 кКал,275 кКал,275 кКал
"PIZZA HUT, сырная пицца ""Cheese Pizza"", на толстом корже, 12 дюймов",280 кКал,280 кКал,280 кКал,280 кКал
"PIZZA HUT, сырная пицца ""Cheese Pizza"", на толстом корже, 14 дюймов",276 кКал,276 кКал,276 кКал,276 кКал
"PIZZA HUT, сырная пицца ""Cheese Pizza"", на тонком хрустящем корже, 12 дюймов",303 кКал,303 кКал,303 кКал,303 кКал
"PIZZA HUT, сырная пицца ""Cheese Pizza"", на тонком хрустящем корже, 14 дюймов",306 кКал,306 кКал,306 кКал,306 кКал
"POPEYES, бисквит, информация состоянием на ноябрь 2007",401 кКал,401 кКал,401 кКал,401 кКал
"POPEYES, жареная в панировке курица, бедра, мясо и шкурка, информация состоянием на январь 2007",310 кКал,310 кКал,310 кКал,310 кКал
"POPEYES, жареная в панировке курица, грудка, мясо и шкурка, информация состоянием на январь 2007",274 кКал,274 кКал,274 кКал,274 кКал
"POPEYES, жареная в панировке курица, крылышки, мясо и шкурка, информация состоянием на  январь 2007",338 кКал,338 кКал,338 кКал,338 кКал
"POPEYES, жареная в панировке курица, ножки, мясо и шкурка, острые, информация состоянием на  январь 2007",293 кКал,293 кКал,293 кКал,293 кКал
"POPEYES, жареная в панировке курица, шкурка, информация состоянием на  январь 2007",433 кКал,433 кКал,433 кКал,433 кКал
"POPEYES, жареная курица, бедра, только мясо, информация состоянием на  январь 2007",188 кКал,188 кКал,188 кКал,188 кКал
"POPEYES, жареная курица, грудка, только мясо, информация состоянием на  январь 2007",157 кКал,157 кКал,157 кКал,157 кКал
"POPEYES, жареная курица, крылышки, только мясо, информация состоянием на  январь 2007",212 кКал,212 кКал,212 кКал,212 кКал
"POPEYES, жареная курица, ножки, только мясо, информация состоянием на  январь 2007",170 кКал,170 кКал,170 кКал,170 кКал
"POPEYES, куринные полосочки, информация состоянием на  2006 год",271 кКал,271 кКал,271 кКал,271 кКал
"POPEYES, острые куринные полосочки, информация состоянием на  2006 год",253 кКал,253 кКал,253 кКал,253 кКал
"POPEYES, салат из капусты",161 кКал,161 кКал,161 кКал,161 кКал
"TACO BELL, буррито ""SUPREME"" с говядиной",183 кКал,183 кКал,183 кКал,183 кКал
"TACO BELL, буррито ""SUPREME"" с курицей",179 кКал,179 кКал,179 кКал,179 кКал
"TACO BELL, буррито ""SUPREME"" со стейком",183 кКал,183 кКал,183 кКал,183 кКал
"TACO BELL, буррито с бобами",209 кКал,209 кКал,209 кКал,209 кКал
"TACO BELL, мягкое тако (тако с пшеничной лепешкой) с говядиной",206 кКал,206 кКал,206 кКал,206 кКал
"TACO BELL, мягкое тако (тако с пшеничной лепешкой) с курицей",189 кКал,189 кКал,189 кКал,189 кКал
"TACO BELL, мягкое тако (тако с пшеничной лепешкой) со стейком",225 кКал,225 кКал,225 кКал,225 кКал
"TACO BELL, начо (картофельные чипсы)",350 кКал,350 кКал,350 кКал,350 кКал
"TACO BELL, начо (картофельные чипсы) с соусом сюприм",246 кКал,246 кКал,246 кКал,246 кКал
"TACO BELL, Оригинальное тако с говядиной",229 кКал,229 кКал,229 кКал,229 кКал
"TACO BELL, салат тако",170 кКал,170 кКал,170 кКал,170 кКал
"WENDY'S, гамбургер ""CLASSIC SINGLE"", без сыра",213 кКал,213 кКал,213 кКал,213 кКал
"WENDY'S, гамбургер ""CLASSIC SINGLE"", с сыром",221 кКал,221 кКал,221 кКал,221 кКал
"WENDY'S, гамбургер ""Jr. Hamburger"", без сыра",243 кКал,243 кКал,243 кКал,243 кКал
"WENDY'S, гамбургер ""Jr. Hamburger"", с сыром",256 кКал,256 кКал,256 кКал,256 кКал
"WENDY'S, замороженные десерты на каждый день ""Frosty Dairy Dessert""",132 кКал,132 кКал,132 кКал,132 кКал
"WENDY'S, классический двойной сэндвич ""CLASSIC DOUBLE"", с сыром",241 кКал,241 кКал,241 кКал,241 кКал
"WENDY'S, куринные нагетсы",326 кКал,326 кКал,326 кКал,326 кКал
"WENDY'S, сэндвич с куриным филе по-домашнему (Homestyle Chicken Fillet Sandwich)",214 кКал,214 кКал,214 кКал,214 кКал
"WENDY'S, сэндвич с куриным филе, приготовленным на гриле (Ultimate Chicken Grill Sandwich)",179 кКал,179 кКал,179 кКал,179 кКал
"Легкое мягкое мороженое, смешанное с конфетами из молочного шоколада",182 кКал,182 кКал,182 кКал,182 кКал
"Легкое мягкое мороженое, смешанное с кусочками печенья",169 кКал,169 кКал,169 кКал,169 кКал
"Макдональдс, Бэкон Ранч, салат без цыпленка",61 кКал,61 кКал,61 кКал,61 кКал
"Макдональдс, Бэкон Ранч, салат с цыпленком гриль",81 кКал,81 кКал,81 кКал,81 кКал
"Макдональдс, Сайд Салат",20 кКал,20 кКал,20 кКал,20 кКал
"Пицца, с мясом и овощами, на растущем корже, замороженная, приготовленная",271 кКал,271 кКал,271 кКал,271 кКал
"Пицца, с мясом и овощами, на стандартном корже, замороженная, приготовленная",276 кКал,276 кКал,276 кКал,276 кКал
"Пицца, с паперони, на стандартном корже, замороженная, приготовленная",274 кКал,274 кКал,274 кКал,274 кКал
"Пицца, с сыром, замороженная, приготовленная",268 кКал,268 кКал,268 кКал,268 кКал
"Пицца, с сыром, на растущем корже, замороженная, приготовленная",260 кКал,260 кКал,260 кКал,260 кКал
"Сэндвич с сосиской ""Sausage Griddle Cake Sandwich""",318 кКал,318 кКал,318 кКал,318 кКал
"Сэндвич с яйцом, сыром и беконом ""Griddle Cak""",272 кКал,272 кКал,272 кКал,272 кКал
"Сэндвич с яйцом, сыром и сосиской ""Griddle Cak""",291 кКал,291 кКал,291 кКал,291 кКал
"Фаст фуд, жареный цыпленок, бедрышки, мясо с кожицей, в панировке",274 кКал,274 кКал,274 кКал,274 кКал
"Фаст фуд, жареный цыпленок, бедрышки, только мясо, без кожицы и без панировки",178 кКал,178 кКал,178 кКал,178 кКал
"Фаст фуд, жареный цыпленок, голень, мясо с кожицей, в панировке",267 кКал,267 кКал,267 кКал,267 кКал
"Фаст фуд, жареный цыпленок, голень, только мясо, без кожицы и без панировки",172 кКал,172 кКал,172 кКал,172 кКал
"Фаст фуд, жареный цыпленок, грудки, только мясо, без кожицы и без панировки",153 кКал,153 кКал,153 кКал,153 кКал
"Фаст фуд, жареный цыпленок, кожа в панировке",398 кКал,398 кКал,398 кКал,398 кКал
"Фаст фуд, жареный цыпленок, крылышки, мясо с кожицей, в панировке",310 кКал,310 кКал,310 кКал,310 кКал
"Фаст фуд, жареный цыпленок, крылышки, только мясо, без кожицы и без панировки",215 кКал,215 кКал,215 кКал,215 кКал
"Фаст фуд, клаб сэндвич (трехслойный), с курицей-гриль, беконом, томатами, сыром, салатом и майонезом",220 кКал,220 кКал,220 кКал,220 кКал
"Фаст фуд, клаб сэндвич (трехслойный), с хрустящей курицей, беконом, томатами, сыром, салатом и майонезом",257 кКал,257 кКал,257 кКал,257 кКал
"Фаст-фуд, английский кекс, с сыром и сосиской",338 кКал,338 кКал,338 кКал,338 кКал
"Фаст-фуд, английский кекс, с яйцом, сыром и канадским беконом",228 кКал,228 кКал,228 кКал,228 кКал
"Фаст-фуд, английский кекс, с яйцом, сыром и сосиской",286 кКал,286 кКал,286 кКал,286 кКал
"Фаст-фуд, бисквит с ветчиной",342 кКал,342 кКал,342 кКал,342 кКал
"Фаст-фуд, бисквит с сосиской",371 кКал,371 кКал,371 кКал,371 кКал
"Фаст-фуд, бисквит с яйцом и беконом",305 кКал,305 кКал,305 кКал,305 кКал
"Фаст-фуд, бисквит с яйцом и ветчиной",233 кКал,233 кКал,233 кКал,233 кКал
"Фаст-фуд, бисквит с яйцом и сосиской",312 кКал,312 кКал,312 кКал,312 кКал
