Продукт,Калорийность,Белки,Жиры,Углеводы"Пшеничная мука высшего сорта, 11,5% белка, отбеленная, обогащенная",363 кКал,363 кКал,363 кКал,363 кКал
"Пшеничная мука высшего сорта, 13% белка, отбеленная, необогащенная",362 кКал,362 кКал,362 кКал,362 кКал
"Пшеничная мука высшего сорта, 13% белка, отбеленная, обогащенная",362 кКал,362 кКал,362 кКал,362 кКал
"Пшеничная мука высшего сорта, 15% белка, отбеленная, необогащенная",362 кКал,362 кКал,362 кКал,362 кКал
"Пшеничная мука высшего сорта, 15% белка, отбеленная, обогащенная",362 кКал,362 кКал,362 кКал,362 кКал
"Пшеничная мука высшего сорта, 9% белка, отбеленная, необогащенная",367 кКал,367 кКал,367 кКал,367 кКал
"Пшеничная мука высшего сорта, 9% белка, отбеленная, обогащенная",367 кКал,367 кКал,367 кКал,367 кКал
"Пшеничная мука высшего сорта, кондитерская, обогащенная",362 кКал,362 кКал,362 кКал,362 кКал
"Пшеничная мука высшего сорта, смесь для тортильи, обогащенная",405 кКал,405 кКал,405 кКал,405 кКал
"Пшеничная мука высшего сорта, универсальная, необогащенная",364 кКал,364 кКал,364 кКал,364 кКал
"Пшеничная мука высшего сорта, универсальная, обогащенная кальцием",364 кКал,364 кКал,364 кКал,364 кКал
"Пшеничная мука высшего сорта, универсальная, обогащенная, неотбеленная",364 кКал,364 кКал,364 кКал,364 кКал
"Пшеничная мука высшего сорта, универсальная, обогащенная, отбеленная",364 кКал,364 кКал,364 кКал,364 кКал
"Пшеничная мука высшего сорта, универсальная, обогащенная, самоподнимающаяся",354 кКал,354 кКал,354 кКал,354 кКал
"Пшеничная мука высшего сорта, хлебопекарная, обогащенная",361 кКал,361 кКал,361 кКал,361 кКал
Пшеничная мука цельнозерновая,340 кКал,340 кКал,340 кКал,340 кКал
Пшеничная мука цельнозерновая из мягкой пшеницы,332 кКал,332 кКал,332 кКал,332 кКал
"Пшеничная мука, второго сорта",324 кКал,324 кКал,324 кКал,324 кКал
"Пшеничная мука, высшего сорта",334 кКал,334 кКал,334 кКал,334 кКал
"Пшеничная мука, высшего сорта, витаминизированная",334 кКал,334 кКал,334 кКал,334 кКал
"Пшеничная мука, обойная",312 кКал,312 кКал,312 кКал,312 кКал
"Пшеничная мука, первого сорта",329 кКал,329 кКал,329 кКал,329 кКал
"Пшеничная мука, первого сорта, витаминизированная",331 кКал,331 кКал,331 кКал,331 кКал
"Пшеничная мука, хлебопекарная, необогащенная",361 кКал,361 кКал,361 кКал,361 кКал
"Пшеничные зародыши, сырые",360 кКал,360 кКал,360 кКал,360 кКал
Пшеничные отруби,165 кКал,165 кКал,165 кКал,165 кКал
"Пшеничные отруби, сырые",216 кКал,216 кКал,216 кКал,216 кКал
Пшенная каша по 1-278,109 кКал,109 кКал,109 кКал,109 кКал
"Пшенная крупа, пшено шлифованное",342 кКал,342 кКал,342 кКал,342 кКал
Пшенная мука,382 кКал,382 кКал,382 кКал,382 кКал
Пшено (просо) воздушное,354 кКал,354 кКал,354 кКал,354 кКал
"Пшено, приготовленное",119 кКал,119 кКал,119 кКал,119 кКал
"Пшено, сырое",378 кКал,378 кКал,378 кКал,378 кКал
"Ржаная мука, обдирная",298 кКал,298 кКал,298 кКал,298 кКал
"Ржаная мука, обдирная",349 кКал,349 кКал,349 кКал,349 кКал
"Ржаная мука, обойная",294 кКал,294 кКал,294 кКал,294 кКал
"Ржаная мука, обойная",325 кКал,325 кКал,325 кКал,325 кКал
"Ржаная мука, сеяная",305 кКал,305 кКал,305 кКал,305 кКал
"Ржаная мука, сеяная",357 кКал,357 кКал,357 кКал,357 кКал
Ржаные отруби,"114,2 кКал","114,2 кКал","114,2 кКал","114,2 кКал"
"Рис белый длиннозерный, быстроразваривающийся, обогащенный, приготовленный",124 кКал,124 кКал,124 кКал,124 кКал
"Рис белый длиннозерный, быстроразваривающийся, обогащенный, сухой",380 кКал,380 кКал,380 кКал,380 кКал
"Рис белый длиннозерный, обогащенный, приготовленный",130 кКал,130 кКал,130 кКал,130 кКал
"Рис белый длиннозерный, обогащенный, приготовленный с солью",130 кКал,130 кКал,130 кКал,130 кКал
"Рис белый длиннозерный, обогащенный, сухой",365 кКал,365 кКал,365 кКал,365 кКал
"Рис белый длиннозерный, приготовленный без соли",130 кКал,130 кКал,130 кКал,130 кКал
"Рис белый длиннозерный, приготовленный с солью",130 кКал,130 кКал,130 кКал,130 кКал
"Рис белый длиннозерный, пропаренный, обогащенный, приготовленный",123 кКал,123 кКал,123 кКал,123 кКал
"Рис белый длиннозерный, пропаренный, обогащенный, сухой",374 кКал,374 кКал,374 кКал,374 кКал
"Рис белый длиннозерный, пропаренный, приготовленный",123 кКал,123 кКал,123 кКал,123 кКал
"Рис белый длиннозерный, сухой",365 кКал,365 кКал,365 кКал,365 кКал
"Рис белый длиннозерный, сухой",374 кКал,374 кКал,374 кКал,374 кКал
"Рис белый клейкий (азиатский), приготовленный",97 кКал,97 кКал,97 кКал,97 кКал
"Рис белый клейкий (азиатский), сухой",370 кКал,370 кКал,370 кКал,370 кКал
"Рис белый короткозерный, обогащенный, приготовленный",130 кКал,130 кКал,130 кКал,130 кКал
"Рис белый короткозерный, обогащенный, сухой",358 кКал,358 кКал,358 кКал,358 кКал
"Рис белый короткозерный, приготовленный",130 кКал,130 кКал,130 кКал,130 кКал
"Рис белый короткозерный, сухой",358 кКал,358 кКал,358 кКал,358 кКал
Рис белый приготовленный на пару (Китайская кухня),151 кКал,151 кКал,151 кКал,151 кКал
"Рис белый среднезерный, обогащенный, приготовленный",130 кКал,130 кКал,130 кКал,130 кКал
"Рис белый среднезерный, обогащенный, сухой",360 кКал,360 кКал,360 кКал,360 кКал
"Рис белый среднезерный, приготовленный",130 кКал,130 кКал,130 кКал,130 кКал
"Рис белый среднезерный, сухой",360 кКал,360 кКал,360 кКал,360 кКал
"Рис белый, крупа рисовая",333 кКал,333 кКал,333 кКал,333 кКал
"Рис дикий (черный, индейский рис, цициания), приготовленный",101 кКал,101 кКал,101 кКал,101 кКал
"Рис дикий (черный, индейский рис, цициания), сухой",357 кКал,357 кКал,357 кКал,357 кКал
"Рис желтый со специями, сухая смесь",343 кКал,343 кКал,343 кКал,343 кКал
"Рис коричневый (нешлифованный) длиннозерный, приготовленный",123 кКал,123 кКал,123 кКал,123 кКал
"Рис коричневый (нешлифованный) длиннозерный, сухой",367 кКал,367 кКал,367 кКал,367 кКал
"Рис коричневый (нешлифованный) среднезерный, приготовленный",112 кКал,112 кКал,112 кКал,112 кКал
"Рис коричневый (нешлифованный) среднезерный, сухой",362 кКал,362 кКал,362 кКал,362 кКал
"Рис коричневый (нешлифованный), пропаренный, приготовленный, UNCLE BENS",147 кКал,147 кКал,147 кКал,147 кКал
"Рис коричневый (нешлифованный), пропаренный. сухой, UNCLE BEN'S",370 кКал,370 кКал,370 кКал,370 кКал
"Рис крем, дроблёный рис быстрорастворимый, приготовленный на воде с солью",52 кКал,52 кКал,52 кКал,52 кКал
"Рис крем, дроблёный рис быстрорастворимый, сухой",370 кКал,370 кКал,370 кКал,370 кКал
"Рис, зерно цельное необработанное",303 кКал,303 кКал,303 кКал,303 кКал
Рисовая запеканка по 1-288,144 кКал,144 кКал,144 кКал,144 кКал
Рисовая запеканка с творогом по 1-288,189 кКал,189 кКал,189 кКал,189 кКал
Рисовая каша по 1-268,144 кКал,144 кКал,144 кКал,144 кКал
"Рисовая лапша, приготовленная",108 кКал,108 кКал,108 кКал,108 кКал
"Рисовая лапша, сухая",364 кКал,364 кКал,364 кКал,364 кКал
Рисовая мука диетическая,356 кКал,356 кКал,356 кКал,356 кКал
"Рисовая мука, белая",366 кКал,366 кКал,366 кКал,366 кКал
"Рисовая мука, коричневая",363 кКал,363 кКал,363 кКал,363 кКал
"Рисовые отруби, сырые",316 кКал,316 кКал,316 кКал,316 кКал
Рожь молотая жареная,322 кКал,322 кКал,322 кКал,322 кКал
"Рожь, зерно",338 кКал,338 кКал,338 кКал,338 кКал
"Рожь, зерно цельное необработанное",283 кКал,283 кКал,283 кКал,283 кКал
Сорго,323 кКал,323 кКал,323 кКал,323 кКал
Сорго,329 кКал,329 кКал,329 кКал,329 кКал
"Спагетти со шпинатом, приготовленные",130 кКал,130 кКал,130 кКал,130 кКал
"Спагетти со шпинатом, сухие",372 кКал,372 кКал,372 кКал,372 кКал
"Спагетти, обогащенные протеином, приготовленные",164 кКал,164 кКал,164 кКал,164 кКал
"Спагетти, обогащенные протеином, сухие",374 кКал,374 кКал,374 кКал,374 кКал
"Сухой завтрак,  MALT-O-MEAL, обычный, сухой",361 кКал,361 кКал,361 кКал,361 кКал
"Сухой завтрак, CREAM OF WHEAT, обычный, приготовленный на воде, без соли",50 кКал,50 кКал,50 кКал,50 кКал
"Сухой завтрак, CREAM OF WHEAT, обычный, сухой",370 кКал,370 кКал,370 кКал,370 кКал
"Сухой завтрак, готовый к употреблению, GENERAL MILLS TOTAL, Cranberry Crunch",328 кКал,328 кКал,328 кКал,328 кКал
"Сухой завтрак, готовый к употреблению, GENERAL MILLS, Curves Fruit & Nut Crunch cereal",347 кКал,347 кКал,347 кКал,347 кКал
"Сухой завтрак, готовый к употреблению, GENERAL MILLS, DORA THE EXPLORER",366 кКал,366 кКал,366 кКал,366 кКал
"Сухой завтрак, готовый к употреблению, GENERAL MILLS, Fruity CHEERIOS",383 кКал,383 кКал,383 кКал,383 кКал
"Сухой завтрак, готовый к употреблению, GENERAL MILLS, OATMEAL CRISP with Almonds",393 кКал,393 кКал,393 кКал,393 кКал
"Сухой завтрак, готовый к употреблению, KELLOGG'S SPECIAL K Chocolatey Delight",381 кКал,381 кКал,381 кКал,381 кКал
"Сухой завтрак, готовый к употреблению, QUAKER, QUAKER OAT CINNAMON LIFE",373 кКал,373 кКал,373 кКал,373 кКал
"Сухой завтрак, готовый к употреблению, WEETABIX WHOLE WHEAT CEREAL",373 кКал,373 кКал,373 кКал,373 кКал
"Сухой завтрак, готовый к употреблению, воздушная пшеница подслащенная, любой бренд",390 кКал,390 кКал,390 кКал,390 кКал
"Сухой завтрак, готовый к употреблению, колца со вкусом шоколада, подслащенные, любой бренд",415 кКал,415 кКал,415 кКал,415 кКал
"Сухой завтрак, готовый к употреблению, овес и кукуруза и пшеница, квадратики, подслащенные, с кленовым вкусом",430 кКал,430 кКал,430 кКал,430 кКал
"Сухой завтрак, готовый к употреблению, пшеница, дробленная, обычная, без сахара и соли",337 кКал,337 кКал,337 кКал,337 кКал
"Сухой завтрак, фарина, крахмал, картофельная мука, обогащенная, приготовленная на воде, без соли",53 кКал,53 кКал,53 кКал,53 кКал
"Тапиока (маниоковое саго), сухая",358 кКал,358 кКал,358 кКал,358 кКал
"Тефф, неприготовленный",367 кКал,367 кКал,367 кКал,367 кКал
"Тефф, приготовленный",101 кКал,101 кКал,101 кКал,101 кКал
Толокно,363 кКал,363 кКал,363 кКал,363 кКал
Тритикале,336 кКал,336 кКал,336 кКал,336 кКал
Тритикале,293 кКал,293 кКал,293 кКал,293 кКал
"Хомини кукуруза (никстамализированная) белая, консервированная",72 кКал,72 кКал,72 кКал,72 кКал
"Хомини кукуруза (никстамализированная), желтая, консервированная",72 кКал,72 кКал,72 кКал,72 кКал
Ячменная мука,284 кКал,284 кКал,284 кКал,284 кКал
Ячменная мука или крупка,345 кКал,345 кКал,345 кКал,345 кКал
Ячменный солод,361 кКал,361 кКал,361 кКал,361 кКал
Ячмень вылущенный,354 кКал,354 кКал,354 кКал,354 кКал
"Ячмень, зерно цельное необработанное",288 кКал,288 кКал,288 кКал,288 кКал
Ячневая каша по 1-278,96 кКал,96 кКал,96 кКал,96 кКал
Ячневая крупа,313 кКал,313 кКал,313 кКал,313 кКал
