Продукт,Калорийность,Белки,Жиры,Углеводы
"Амарант, зерна, неприготовленные",371 кКал,371 кКал,371 кКал,371 кКал
"Амарант, зерна, приготовленные",102 кКал,102 кКал,102 кКал,102 кКал
Амарантовые хлопья,353 кКал,353 кКал,353 кКал,353 кКал
Аррорут (крахмал из клубней маранты),357 кКал,357 кКал,357 кКал,357 кКал
"Биточки перловые с творогом, по 1-294",166 кКал,166 кКал,166 кКал,166 кКал
"Биточки пшенные, по 1-292",170 кКал,170 кКал,170 кКал,170 кКал
"Булгур, крупа",342 кКал,342 кКал,342 кКал,342 кКал
"Булгур, приготовленный",83 кКал,83 кКал,83 кКал,83 кКал
"Готовый завтрак,  воздушная пшеница, обогащенный",364 кКал,364 кКал,364 кКал,364 кКал
"Готовый завтрак, воздушный рис (произв: The Quaker Oats, Co.)",383 кКал,383 кКал,383 кКал,383 кКал
"Готовый завтрак, воздушный рис, обогащенный",402 кКал,402 кКал,402 кКал,402 кКал
"Готовый завтрак, зародыши пшеницы, поджаренные",382 кКал,382 кКал,382 кКал,382 кКал
"Готовый завтрак, овсяные колечки с кусочками пастилы",400 кКал,400 кКал,400 кКал,400 кКал
"Готовый завтрак, овсяные подушечки с корицей, QUAKER",379 кКал,379 кКал,379 кКал,379 кКал
"Готовый завтрак, овсяные подушечки, QUAKER",379 кКал,379 кКал,379 кКал,379 кКал
"Готовый завтрак, пшеница с отрубями, орехами и фруктами, сухой",385 кКал,385 кКал,385 кКал,385 кКал
"Готовый завтрак, хрустящий рис (произв: Ральстон Фудс)",383 кКал,383 кКал,383 кКал,383 кКал
"Готовый завтрак, хрустящий рис, MALT-O-MEAL",346 кКал,346 кКал,346 кКал,346 кКал
"Гречиха, зерно",343 кКал,343 кКал,343 кКал,343 кКал
"Гречиха, зерно цельное необработанное",296 кКал,296 кКал,296 кКал,296 кКал
Гречневая каша из крупы ядрица по 1-278,101 кКал,101 кКал,101 кКал,101 кКал
Гречневая каша рассыпчатая (гречка отварная без соли и масла),"100,9 кКал","100,9 кКал","100,9 кКал","100,9 кКал"
Гречневая крупа продел,300 кКал,300 кКал,300 кКал,300 кКал
Гречневая крупа ядрица,308 кКал,308 кКал,308 кКал,308 кКал
"Гречневая крупа, обжаренная, приготовленная",92 кКал,92 кКал,92 кКал,92 кКал
"Гречневая крупа, обжаренная, сухая",346 кКал,346 кКал,346 кКал,346 кКал
Гречневая мука,353 кКал,353 кКал,353 кКал,353 кКал
"Гречневая мука, цельнозерновая",335 кКал,335 кКал,335 кКал,335 кКал
Дрожжи прессованные (*эргостерин),109 кКал,109 кКал,109 кКал,109 кКал
"Инкапарина, смесь кукурузной и соевой муки, неприготовленный",379 кКал,379 кКал,379 кКал,379 кКал
"Камут (пшеница хорасан), неприготовленный",337 кКал,337 кКал,337 кКал,337 кКал
"Камут (пшеница хорасан), приготовленный",132 кКал,132 кКал,132 кКал,132 кКал
Картофельный крахмал,357 кКал,357 кКал,357 кКал,357 кКал
"Каша фарина (крахмал, картофельная мука), обогащенная, приготовленная на воде, с солью",53 кКал,53 кКал,53 кКал,53 кКал
"Каша фарина (крахмал, картофельная мука), сухая",369 кКал,369 кКал,369 кКал,369 кКал
"Киноа, неприготовленная",368 кКал,368 кКал,368 кКал,368 кКал
"Киноа, приготовленная",120 кКал,120 кКал,120 кКал,120 кКал
"Клецки, по 2-196",131 кКал,131 кКал,131 кКал,131 кКал
Котлеты манные по 1-294,141 кКал,141 кКал,141 кКал,141 кКал
Крахмал картофельный,313 кКал,313 кКал,313 кКал,313 кКал
"Крупеник из гречневой крупы, по 1-288",199 кКал,199 кКал,199 кКал,199 кКал
"Кукуруза белая, зерно сухое",365 кКал,365 кКал,365 кКал,365 кКал
"Кукуруза белая, приготовленная на пару (Навахо)",386 кКал,386 кКал,386 кКал,386 кКал
"Кукуруза желтая, замороженная цельными зернами, приготовленная в микроволновке",113 кКал,113 кКал,113 кКал,113 кКал
"Кукуруза желтая, зерно сухое",365 кКал,365 кКал,365 кКал,365 кКал
"Кукуруза желтая, сухое зерно (индейцы северных великих равнин)",419 кКал,419 кКал,419 кКал,419 кКал
"Кукуруза с красным и зеленым перцем, консервированная",75 кКал,75 кКал,75 кКал,75 кКал
"Кукуруза, высоколизиновая",314 кКал,314 кКал,314 кКал,314 кКал
"Кукуруза, зародыш",147 кКал,147 кКал,147 кКал,147 кКал
"Кукуруза, зерно",325 кКал,325 кКал,325 кКал,325 кКал
"Кукуруза, зубовидная",320 кКал,320 кКал,320 кКал,320 кКал
"Кукуруза, консервы",58 кКал,58 кКал,58 кКал,58 кКал
"Кукурузная каша жидкая, белая, приготовленная на воде, без соли",71 кКал,71 кКал,71 кКал,71 кКал
"Кукурузная каша жидкая, белая, приготовленная на воде, с солью",71 кКал,71 кКал,71 кКал,71 кКал
"Кукурузная каша жидкая, желтая, приготовленная на воде, без соли",65 кКал,65 кКал,65 кКал,65 кКал
"Кукурузная каша жидкая, желтая, приготовленная на воде, с солью",65 кКал,65 кКал,65 кКал,65 кКал
Кукурузная крупа,328 кКал,328 кКал,328 кКал,328 кКал
"Кукурузная крупа, белая, обогащённая",370 кКал,370 кКал,370 кКал,370 кКал
"Кукурузная крупа, желтая",371 кКал,371 кКал,371 кКал,371 кКал
Кукурузная мука,331 кКал,331 кКал,331 кКал,331 кКал
Кукурузная мука белая грубого помола,362 кКал,362 кКал,362 кКал,362 кКал
"Кукурузная мука белая грубого помола, беззародышевая",370 кКал,370 кКал,370 кКал,370 кКал
"Кукурузная мука белая грубого помола, беззародышевая, обогащённая",370 кКал,370 кКал,370 кКал,370 кКал
"Кукурузная мука белая грубого помола, самоподнимающаяся, обогащенная, беззародышевая",355 кКал,355 кКал,355 кКал,355 кКал
"Кукурузная мука белая грубого помола, самоподнимающаяся, просеянная, обогащенная",334 кКал,334 кКал,334 кКал,334 кКал
"Кукурузная мука белая грубого помола, самоподнимающаяся, просеянная, обогащенная, с добавлением пшеничной муки",348 кКал,348 кКал,348 кКал,348 кКал
"Кукурузная мука белая тонкого помола, цельнозерновая",361 кКал,361 кКал,361 кКал,361 кКал
"Кукурузная мука белая, маса (из никстамализированного зерна)",363 кКал,363 кКал,363 кКал,363 кКал
"Кукурузная мука белая, маса (из никстамализированного зерна), обогащенная",363 кКал,363 кКал,363 кКал,363 кКал
"Кукурузная мука желтая грубого помола, беззародышевая",370 кКал,370 кКал,370 кКал,370 кКал
"Кукурузная мука желтая грубого помола, беззародышевая, обогащенная",370 кКал,370 кКал,370 кКал,370 кКал
"Кукурузная мука желтая грубого помола, самоподнимающаяся, беззародышевая, обогащенная",355 кКал,355 кКал,355 кКал,355 кКал
"Кукурузная мука желтая грубого помола, самоподнимающаяся, просеянная, обогащенная",334 кКал,334 кКал,334 кКал,334 кКал
"Кукурузная мука желтая грубого помола, самоподнимающаяся, просеянная, с добавлением пшеничной муки, обогащенная",348 кКал,348 кКал,348 кКал,348 кКал
"Кукурузная мука желтая грубого помола, цельнозерновая",362 кКал,362 кКал,362 кКал,362 кКал
"Кукурузная мука желтая тонкого помола, беззародышевая",375 кКал,375 кКал,375 кКал,375 кКал
"Кукурузная мука желтая тонкого помола, цельнозерновая",361 кКал,361 кКал,361 кКал,361 кКал
"Кукурузная мука желтая, маса (из никстамализированного зерна), обогащенная",363 кКал,363 кКал,363 кКал,363 кКал
"Кукурузная мука фиолетовая тонкого помола, цельнозерновая, (маиз морадо)",364 кКал,364 кКал,364 кКал,364 кКал
"Кукурузная мука, голубая (Навахо)",398 кКал,398 кКал,398 кКал,398 кКал
Кукурузные отруби,224 кКал,224 кКал,224 кКал,224 кКал
Кукурузные хлопья,360 кКал,360 кКал,360 кКал,360 кКал
"Кукурузные хлопья, Ральстон Корн Флэйкс",384 кКал,384 кКал,384 кКал,384 кКал
Кукурузный крахмал,343 кКал,343 кКал,343 кКал,343 кКал
Кукурузный крахмал,381 кКал,381 кКал,381 кКал,381 кКал
Кукурузный пудинг домашнего приготовления,131 кКал,131 кКал,131 кКал,131 кКал
"Кускус (кус-кус), приготовленный",112 кКал,112 кКал,112 кКал,112 кКал
"Кускус (кус-кус), сухой",376 кКал,376 кКал,376 кКал,376 кКал
"Лапша домашняя, по 2-198",322 кКал,322 кКал,322 кКал,322 кКал
"Лапша китайская, плоская, хрустящая",521 кКал,521 кКал,521 кКал,521 кКал
"Лапша китайская, чоу мейн",471 кКал,471 кКал,471 кКал,471 кКал
"Лапша яичная со шпинатом, обогащенная, приготовленная",132 кКал,132 кКал,132 кКал,132 кКал
"Лапша яичная со шпинатом, обогащенная, сухая",382 кКал,382 кКал,382 кКал,382 кКал
"Лапша яичная, обогащенная, приготовленная",138 кКал,138 кКал,138 кКал,138 кКал
"Лапша яичная, обогащенная, приготовленная с добавлением соли",138 кКал,138 кКал,138 кКал,138 кКал
"Лапша яичная, обогащенная, сухая",384 кКал,384 кКал,384 кКал,384 кКал
"Лапша яичная, приготовленная, без соли",138 кКал,138 кКал,138 кКал,138 кКал
"Лапша яичная, приготовленная, с солью",138 кКал,138 кКал,138 кКал,138 кКал
"Лапша яичная, сухая",384 кКал,384 кКал,384 кКал,384 кКал
"Лапша японская, соба, приготовленная",99 кКал,99 кКал,99 кКал,99 кКал
"Лапша японская, соба, сухая",336 кКал,336 кКал,336 кКал,336 кКал
"Лапша японская, сомен, приготовленная",131 кКал,131 кКал,131 кКал,131 кКал
"Лапша японская, сомен, сухая",356 кКал,356 кКал,356 кКал,356 кКал
"Лапшевник с творогом, по 1-308",180 кКал,180 кКал,180 кКал,180 кКал
"Макароны запеченные с яйцом, по 1 -306",152 кКал,152 кКал,152 кКал,152 кКал
Макароны из муки 1 сорта,333 кКал,333 кКал,333 кКал,333 кКал
Макароны из муки высшего сорта,338 кКал,338 кКал,338 кКал,338 кКал
"Макароны из муки высшего сорта, витаминизированные",337 кКал,337 кКал,337 кКал,337 кКал
"Макароны из муки высшего сорта, молочные",345 кКал,345 кКал,345 кКал,345 кКал
"Макароны из муки высшего сорта, яичные",342 кКал,342 кКал,342 кКал,342 кКал
"Макароны отварные с жиром, по 1-304",135 кКал,135 кКал,135 кКал,135 кКал
"Макароны отварные, по 1-302",98 кКал,98 кКал,98 кКал,98 кКал
"Макароны с овощами, обогащенные, приготовленные",128 кКал,128 кКал,128 кКал,128 кКал
"Макароны с овощами, обогащенные, сухие",367 кКал,367 кКал,367 кКал,367 кКал
"Манная каша вязкая, по 1-276",100 кКал,100 кКал,100 кКал,100 кКал
Манная крупа,333 кКал,333 кКал,333 кКал,333 кКал
"Манная крупа, необогащенная",360 кКал,360 кКал,360 кКал,360 кКал
"Манная крупа, обогащенная",360 кКал,360 кКал,360 кКал,360 кКал
Мука из зародышей пшеницы,335 кКал,335 кКал,335 кКал,335 кКал
Мука из сорго,357 кКал,357 кКал,357 кКал,357 кКал
"Мука из сорго, цельнозерновая",359 кКал,359 кКал,359 кКал,359 кКал
Мука из тритикале,338 кКал,338 кКал,338 кКал,338 кКал
"Овес, зерно",316 кКал,316 кКал,316 кКал,316 кКал
"Овес, зерно сухое",389 кКал,389 кКал,389 кКал,389 кКал
"Овсяная каша быстрого приготовления (растворимая) с изюмом и специями, приготовленная на воде",88 кКал,88 кКал,88 кКал,88 кКал
"Овсяная каша быстрого приготовления (растворимая) с корицей и специями, приготовленная на воде",96 кКал,96 кКал,96 кКал,96 кКал
"Овсяная каша быстрого приготовления (растворимая) с корицей и специями, сухая",369 кКал,369 кКал,369 кКал,369 кКал
"Овсяная каша быстрого приготовления (растворимая), приготовленная на воде",68 кКал,68 кКал,68 кКал,68 кКал
"Овсяная каша быстрого приготовления (растворимая), с кленовым и коричневым сахаром, сухая",386 кКал,386 кКал,386 кКал,386 кКал
"Овсяная каша быстрого приготовления (растворимая), сухая",362 кКал,362 кКал,362 кКал,362 кКал
"Овсяная каша жидкая, приготовленная на воде, без соли",71 кКал,71 кКал,71 кКал,71 кКал
"Овсяная каша жидкая, приготовленная на воде, с солью",71 кКал,71 кКал,71 кКал,71 кКал
"Овсяная каша из хлопьев «Геркулес», по 1-280",105 кКал,105 кКал,105 кКал,105 кКал
"Овсяная каша, по 1-280",109 кКал,109 кКал,109 кКал,109 кКал
Овсяная крупа,379 кКал,379 кКал,379 кКал,379 кКал
Овсяная крупа,342 кКал,342 кКал,342 кКал,342 кКал
Овсяная мука,369 кКал,369 кКал,369 кКал,369 кКал
Овсяная мука с отрубями,404 кКал,404 кКал,404 кКал,404 кКал
"Овсянка быстрорастворимая с корицей, сухая (произв: The Quaker Oats, Co.)",369 кКал,369 кКал,369 кКал,369 кКал
Овсяные отруби,246 кКал,246 кКал,246 кКал,246 кКал
"Овсяные отруби, приготовленные",40 кКал,40 кКал,40 кКал,40 кКал
"Овсяные хлопья ""геркулес""",352 кКал,352 кКал,352 кКал,352 кКал
"Паста (макароны, спагетти)  из кукурузной муки, безглютеновые, приготовленные",126 кКал,126 кКал,126 кКал,126 кКал
"Паста (макароны, спагетти) без яиц, домашняя, приготовленная",124 кКал,124 кКал,124 кКал,124 кКал
"Паста (макароны, спагетти) из коричневой рисовой муки, безглютеновая, приготовленная",138 кКал,138 кКал,138 кКал,138 кКал
"Паста (макароны, спагетти) из кукурузной и рисовой муки, безглютеновая, приготовленная",179 кКал,179 кКал,179 кКал,179 кКал
"Паста (макароны, спагетти) из кукурузной муки и муки киноа, безглютеновая, приготовленная",152 кКал,152 кКал,152 кКал,152 кКал
"Паста (макароны, спагетти) из кукурузной муки, безглютеновые",357 кКал,357 кКал,357 кКал,357 кКал
"Паста (макароны, спагетти) из рисовой муки с экстрактом из рисовых отрубей, безглютеновая, приготовленная",200 кКал,200 кКал,200 кКал,200 кКал
"Паста (макароны, спагетти) из цельнозерновой муки, приготовленная",149 кКал,149 кКал,149 кКал,149 кКал
"Паста (макароны, спагетти) из цельнозерновой муки, сухая",352 кКал,352 кКал,352 кКал,352 кКал
"Паста (макароны, спагетти) яичная, домашняя, приготовленная",130 кКал,130 кКал,130 кКал,130 кКал
"Паста (макароны, спагетти), обогащенные, приготовленные без соли",158 кКал,158 кКал,158 кКал,158 кКал
"Паста (макароны, спагетти), обогащенные, приготовленные с солью",157 кКал,157 кКал,157 кКал,157 кКал
"Паста (макароны, спагетти), обогащенные, сухие",371 кКал,371 кКал,371 кКал,371 кКал
"Паста (макароны, спагетти), приготовленная без соли",158 кКал,158 кКал,158 кКал,158 кКал
"Паста (макароны, спагетти), приготовленная с солью",157 кКал,157 кКал,157 кКал,157 кКал
"Паста (макароны, спагетти), свежезамороженная, неприготовленная",288 кКал,288 кКал,288 кКал,288 кКал
"Паста (макароны, спагетти), свежезамороженная, приготовленная",131 кКал,131 кКал,131 кКал,131 кКал
"Паста (макароны, спагетти), свежезамороженная, со шпинатом, неприготовленная",289 кКал,289 кКал,289 кКал,289 кКал
"Паста (макароны, спагетти), свежезамороженная, со шпинатом, приготовленная",130 кКал,130 кКал,130 кКал,130 кКал
"Паста (макароны, спагетти), сухая",371 кКал,371 кКал,371 кКал,371 кКал
Перловая каша по 1-270,135 кКал,135 кКал,135 кКал,135 кКал
Перловая крупа,315 кКал,315 кКал,315 кКал,315 кКал
Перловая крупа,352 кКал,352 кКал,352 кКал,352 кКал
"Перловая крупа, приготовленная",123 кКал,123 кКал,123 кКал,123 кКал
"Полба (спельта), неприготовленная",338 кКал,338 кКал,338 кКал,338 кКал
"Полба (спельта), приготовленная",127 кКал,127 кКал,127 кКал,127 кКал
"Просо, зерно продовольственное",298 кКал,298 кКал,298 кКал,298 кКал
Пудинг рисовый по 1-292,202 кКал,202 кКал,202 кКал,202 кКал
Пшеница мягкая белозёрная,340 кКал,340 кКал,340 кКал,340 кКал
Пшеница мягкая краснозёрная озимая,331 кКал,331 кКал,331 кКал,331 кКал
"Пшеница мягкая, зерно",305 кКал,305 кКал,305 кКал,305 кКал
Пшеница проросшая,198 кКал,198 кКал,198 кКал,198 кКал
Пшеница стекловидная белозёрная,342 кКал,342 кКал,342 кКал,342 кКал
Пшеница стекловидная краснозёрная озимая,327 кКал,327 кКал,327 кКал,327 кКал
Пшеница стекловидная краснозёрная яровая,329 кКал,329 кКал,329 кКал,329 кКал
"Пшеница твердая, зерно",339 кКал,339 кКал,339 кКал,339 кКал
"Пшеница твердая, зерно",304 кКал,304 кКал,304 кКал,304 кКал
"Пшеничная каша жидкая, проготовленная на воде, без соли",62 кКал,62 кКал,62 кКал,62 кКал
"Пшеничная каша жидкая, проготовленная на воде, с солью",62 кКал,62 кКал,62 кКал,62 кКал
"Пшеничная каша рассыпчатая из крупы «Полтавская», по 1-272",153 кКал,153 кКал,153 кКал,153 кКал
Пшеничная клейковина (глютен),370 кКал,370 кКал,370 кКал,370 кКал
Пшеничная крупа,342 кКал,342 кКал,342 кКал,342 кКал
"Пшеничная крупа ""Артек""",329 кКал,329 кКал,329 кКал,329 кКал
"Пшеничная крупа ""Полтавская""",329 кКал,329 кКал,329 кКал,329 кКал
Пшеничная мука высшего сорта из мягкой пшеницы,334 кКал,334 кКал,334 кКал,334 кКал
"Пшеничная мука высшего сорта, 10% белка, неотбеленная, обогащенная",366 кКал,366 кКал,366 кКал,366 кКал
"Пшеничная мука высшего сорта, 10% белка, отбеленная, необогащенная",366 кКал,366 кКал,366 кКал,366 кКал
"Пшеничная мука высшего сорта, 10% белка, отбеленная, обогащенная",366 кКал,366 кКал,366 кКал,366 кКал
"Пшеничная мука высшего сорта, 11,5% белка, неотбеленная, обогащенная",363 кКал,363 кКал,363 кКал,363 кКал
"Пшеничная мука высшего сорта, 11,5% белка, отбеленная, необогащенная",363 кКал,363 кКал,363 кКал,363 кКал
